139,1,"Everyday, I go to work at 6 am, I arrive at 7 am and work up to 12, then stay in the company and eat until 5 pm then leave after I get home. Eat rice and go to bed, sometimes go out with friends or play sports",2,0,2,4,2,4,2,4,3,1,3,2,3,4,3,2,4,4,2,3,5,2,3,2,4,1,2,5,3,5,4,4,0,29,2,2,4,4,7,2,Jesus,good survey,"Questions about sex, religion",2,2017-07-02-06-20,2017-07-02-06-33,92
140,1,"I started a doggy daycare out of my home last July and have been doing it full time ever since. I care for mostly seniors and special needs pets. It's a very hard, low paying job, but it's also very rewarding and wonderful (at times). A few months ago, I started taking care of a blind, elderly dachshund 4 days per week. In a short time, he has become very special to us and I am quite attached to him and also very protective of him. He is what caused me to start caring for mostly senior dogs because younger dogs are rambunctious and I feel they are risky to his well being while he's here, so I switcted",1,0,3,2,2,2,2,2,2,3,3,3,4,3,2,4,4,5,2,3,1,4,2,3,3,2,2,2,4,3,2,3,0,39,2,1,5,1,1,1,Raised strict Irish/Catholic.,That there would be a writing exercise,Spirituality and deeper beliefs,4,2017-07-02-16-36,2017-07-02-16-53,82
141,2,"I don't consider myself to be religious. While I was raised as a Christian, I don't believe in a specific God or Christianity. I consider myself Agnostic. This is only due to one event in my life. When I was in the 8th grade, my family moved into a large old house. Everything was fine at first, however after a few months I began having nightmares. One such nightmare was that I was in the basement bathroom and the lights went off and the door wouldn't open, so I couldn't get out. The very next day, I was in the same bathroom and the lights turned off and the door somehow got jammed at I couldn't get it open for, what felt like an eternity, however it was probably 30 seconds. My little brother had similar experiences. One occasion I'm sitting in the basement watching TV and I hear a loud bang, look up, and see him tumbling down the stairs. He swore that someone pushed him, even though we were alone in the house. The whole time I was ever in the house, I just knew it was haunted. On another occasion, I was doing my hair in the morning and while looking in the mirror, I heard something s",1,0,2,5,4,3,2,4,4,2,2,5,2,2,3,3,2,2,2,4,4,2,4,2,2,4,2,3,2,3,2,3,0,25,2,1,5,1,2,2,Agnostic,I knew nothing. Only what I had read in the description. That I would be writing something and then answering questions.,I think the researchers were looking for a link between how religious a person is and how profound they view certain phrases.,3,2017-07-01-20-15,2017-07-01-20-25,86
142,2,"I don't know if this convinced me of my religious beliefs, but it was certainly a memorable experience. I rarely have nightmares, but 12 years ago, while sleeping next to my husband, I dreamt that he had lost one of his limbs. I was desperately trying to make things OK. The dream was very intense, and I told my husband about it when he woke up. ~~~~I got up and checked my E-mail, and there was a brief, humorous E-mail from my husband's father. I very rarely heard from him. ~~~~After reading the E-mail, I think I went out to get coffee, and when I came back, my husband was crying. His father had just died of a heart attack, and it happened at the exact time I was dreaming that my husband had lost his limb. At the very least, this experience taught me that there are things you can't explain, and I wondered if we are all connected subconsciously.",1,0,1,1,1,2,1,3,1,1,1,1,2,2,3,2,1,3,2,1,1,2,1,4,2,1,2,2,2,2,3,3,0,45,2,2,3,2,2,1,agnostic,nothing,"I have no idea, but the 30 statements made my head hurt",2,2017-07-01-16-24,2017-07-01-16-35,54
143,1,"All of my day revolves around my family. I recently quit my day job and am now able to stay home with my children. I feel very blessed to be able to be here for them. It makes me feel closer to them, and that I am a better wife and mother for it. My husband and my children are everything to me and I strive to show them how much I love and appreciate them. I try to make sure they have a clean home and home cooked meals, and time together. That's what my day typically consists of.",2,1,2,1,1,5,1,2,1,5,3,4,1,1,2,1,2,3,2,5,1,2,1,1,2,1,2,5,4,3,1,3,0,35,2,2,7,6,3,5,Baptist,Nothing,Relative beliefs between religion and science.,2,2017-07-02-04-22,2017-07-02-04-34,68
144,1,"Everyday, I put things away to where they belong in the apartment. I sometimes do this in the morning before work or in the afternoons when I'm off work or even at night time. I start in one part of the apartment and work my way through the apartment. On the main tasks I do is pick things up off the floor. I am very lazy when I get home and often toss jackets or bags on the ground when I get home. This way, I just pick it all up at one time. Plus I have no one except my husband living with me at the moment and he doesn't really judge this. I put clothes into the laundry hamper or into a cubby in the closet if I think it is clean enough to wear again before washing. I hang sweaters and jackets up the closet. I hang my purse on a hook I have on my bedroom door. Another thing that I may do at this time is put away wires that are sitting around the TV. Sometimes we use an HDMI cable to hook up our laptop to the TV to stream shows from HBO Now, Netfix, etc. Sometimes we have cables for the playstation out. So I will tidy the area. I will also put dishes that are out into the dishwasher to run the dishwasher at night. I really do anything",1,0,3,2,1,1,3,1,1,1,2,2,2,2,4,3,2,5,2,3,2,5,5,4,2,4,4,1,1,3,1,4,0,25,2,1,2,2,3,1,not affliated,I didn't know anything about this experiment,Does writing about a mundane experience affect perception of spirituality?,2,2017-07-03-06-03,2017-07-03-06-19,76
145,2,I was able to go to Zion National Park for the first time and it was a superb experience.  I saw majestic cliffs and sights that I didn't know such beauty could uphold.  I was convinced after that point that there's more to us than being more specks of dust.,1,0,3,1,3,2,3,3,2,4,3,3,3,3,2,4,2,2,3,3,3,2,2,4,3,4,3,4,3,4,2,2,0,38,1,1,5,1,1,1,None,Nothing,how we view spirituality vs religion,2,2017-07-02-16-33,2017-07-02-16-41,85
146,1,"I get up every morning around the same time usually around 7:30 am.I get a cup of coffee , than I go and feed the chicks the cats and the one little pig we have.After I do this I go to the barn and feed the calves I have I have one name little man sam , he is really small he runs around the barn while I feed the other animals.I give him a bottle of milk and grain, He is a twin I lost his sister due to no milk from the mother.I than go and check all my fences .After I get this done I have breakfast usually bacon and eggs and coffee.When I finish up with this I go to my sons house and check on him  ,some times I stay all day and we just talk or look things up on the computer.I than go home cook supper , after supper I go back and feed little man sam another bottle and brush him done .After this I feed the rest of the animals a gain",2,1,3,5,5,2,4,3,3,3,3,3,4,3,3,3,4,2,3,4,3,4,4,2,5,2,3,4,3,2,2,3,0,54,2,2,7,5,6,6,baptist,"I did ntot know any thing about this , i have learned a few new things",i thin it looked how people looked at them self and the belief of God,3,2017-07-02-16-29,2017-07-02-16-43,97
147,2,"There was a time when I found out I was pregnant with my first child and was excited about it from the beginning. My dreams that I had for my child were shattered when I found out she was going to be born with Spina Bifida. It's a congenital defect in which the child is paralyzed and has other issues. So I wasn't a religious person but my best friend at the time invited me to church with her because she thought it would make me feel better. I went just to humor her and when we got there, the pastor announced that Bishop T.D. Jakes was going to be a guest speaker there two weeks from then. I got excited because I liked T.D. Jakes even though I wasn't a Christian. I took it as a sign. I started praying to this god that I didn't believe in for a miracle, that if I was to attend that ceremony and receive a healing for my baby, I would become the best Christian ever, I would build churches in his name. So long story short, I didn't receive the healing but as I was watching television the day after the appointment that confirmed nothing had changed, I was watching a show called Babies: S",2,0,4,4,5,2,4,3,4,5,5,4,3,5,3,4,4,4,4,4,4,5,4,5,3,3,5,3,4,4,4,4,0,38,2,1,7,1,1,1,Atheist,I didn't know anything about the experiment prior to participating.,It might have been trying to gauge how people perceive the universe.,4,2017-07-02-21-13,2017-07-02-21-22,119
148,1,"I get up, I make my coffee and drink it. I like 3 Stevias, honey, and Ceylon cinnamon in it. Then I watch some news and drink my coffee. I get ready for work and then work for a few hours. Then I get home and get ready to go to the gym with my husband. I go to the gym and workout for a couple of hours come home and cook something to eat for both of us. We eat. I pack his dinner for work and get him ready for his job. Then while he is gone I look on the internet for awhile, watch TV before bed. I usually go to bed before he gets home.",1,1,4,1,1,3,1,1,2,4,1,1,3,3,1,1,1,1,1,4,1,2,3,3,5,1,3,3,3,1,4,1,1,50,2,2,7,6,11,4,Christian,Nothing,I have no idea. Perceptions not in reality?,1,2017-07-01-22-11,2017-07-01-22-27,64
149,1,"Today after lunch, I decided to go for a walk.  I asked my daughter if she would like to go with me and she agreed that she would.  We set out walking with no particular destination in mind.  Soon we realized that we were walking to my other daughter's house.  We decided as we were walking that we would see if my eldest granddaughter would like to go to the park and walk a trail with us.  This seemed like a great idea so we set off at a good pace.  As we were walking and talking, a car drove past and started to catcall at us.  Laughing, we both pretended that the guys were yelling at me and that my diet was working beyond expectations. ~~~~We arrived at my daughter's house to find that she was in the garage with all of her daughters.  We started to visit with all of them and really enjoyed being together when it occurred to me that my eldest daughter might need a new bathing suit for her upcoming trip.  We quickly decided that she and I would go shopping as soon as her husband returned.  In a matter of minutes he was home and it was decided that ~~",2,1,4,1,1,5,1,1,1,1,1,1,1,1,1,1,4,1,4,1,1,1,1,1,1,1,1,1,1,1,4,1,0,56,2,2,7,6,8,6,Apostolic Network,nothing,Not a clue,1,2017-07-03-04-09,2017-07-03-04-22,46
150,2,"I do not have a traditional religion, even though I was raised in one, but I have had spiritual experiences in nature. I have always been drawn to the sky. I like to go outside at night and look at the stars. I remember many times when I have gone out on a clear night at gazed at the stars and felt transported to another world. It always made me see things from a whole different perspective, which eventually got me out of my usual small-minded way of thinking. For example, I now see life in a big-picture kind of way. Looking up and realizing how small we are makes me realize that nothing really matters and that my problems are unimportant. I feel more connected to the whole instead of a small person trappe",2,0,1,3,1,1,1,1,2,1,1,1,4,1,3,1,1,1,2,1,1,1,3,4,4,2,2,1,1,4,4,1,0,26,2,1,4,5,3,2,none,nothing,How writing about a spiritual experience affects people's perceptions of the thirty statements. Maybe the thirty statements or the initial task could vary. and maybe there is a control where people don't write anything at the beginning.,2,2017-07-03-05-54,2017-07-03-06-10,55
151,1,"Recently, I awoke to rain, yet again, because this is what normal weather is like in Maine. My body hurt so I decided to go to the gym and get some muscles moving. During that visit to the gym I worked out on some machines and then got a massage as I waited for the trainer. I am habitually on time, he is not, so when we finally did sit down to chat about the fat in my back that I was unimpressed with, we got the idea that it was going to all be hard time cardio. YEAH ME! NOT! Anyway, the reason for the fat in my back is because I recently had to take keifer (google it) to cure an ibs issue. AGAIN YEAH ME! that lasted 9 years! So when I took it noone told me this would happen and I didnt adjust my calorie intake fast enough, and poof, fat climbing up my back. So now I have to do an hour on the treadmill oh crapping bore! And a half hour on this stupid machine thats not an elliptical but kinda like one I have no clue what it is called. CYFLEX who knows but its not at",2,0,3,2,5,2,4,4,1,4,3,4,2,5,4,5,2,3,2,4,2,4,1,5,5,5,1,4,4,3,4,5,0,42,2,2,7,6,5,4,pagan,That it was a study about personality.,"I believe that this study was specifically looking to judge intelligence levels, which is assumed by the writing portion. And also to test they type of person you were testing. I think together the two give a more coherent answer on cognitive abil",2,2017-07-02-04-15,2017-07-02-04-34,102
152,1,"I drove into town to check my balance on the atm at the grocery store, purchase some groceries, then I buzzed by the local Sonic for a bite to eat. Then I drove to the convenience store to put a little gas in my car and get a pack of cigarettes. Then I drove back home, put away the groceries, then I got on my computer to do some mTurk hits while listening to a podcast on Youtube. I occasionally paused at intervals to step outside to smoke a cigarette and collect my thoughts, then put my nose back to the grindstone. Eventually I called it a day and made some food, and then turned in.",1,0,2,1,1,1,1,1,1,1,1,1,2,1,2,1,1,2,1,2,1,2,2,2,2,2,2,2,2,2,2,2,1,34,1,2,5,5,2,4,Something between a Deist and,Something about writing and personality,Something involving people's writing styles having to do with their attitudes towards the metaphysical.,2,2017-07-02-21-14,2017-07-02-21-25,46
153,1,"Since I am retired, my average day doesn't really change all that much. I rescue cats and currently have a dozen cats (not that I want that many, at all). I don't get up too early, but now that it's summer, the majority of my cats prefer to be outside. Thus, I usually get up earlier now that I normally would so I can feed all the cats who chose to stay outside. I can't feed them after dark because I live in a very rural area, and putting cat food outside in the evenings encourages wildlife to visit. If I could afford to feed all the wildlife all the time, maybe that wouldn't be a problem. But I don't want to encourage the wildlife to come close or get dependent on food from me. After feeding the cats, the rest of my days deals with very simple tasks: cleaning, cooking, working in the yard (I have two acres to maintain which is quite a chore), counting the cats to make sure they are all okay another day, checking my email and the news. I don't watch much television and tend to get my news online. Then, I check my Facebook account - maybe play a couple of computer games. And, then, there's always checking on the turking sur",1,0,5,5,4,2,4,4,4,3,5,4,4,5,4,5,2,5,5,3,5,4,3,5,2,5,5,3,4,5,5,5,0,64,2,1,5,1,1,1,Atheist,I knew nothing about this experience.,"I'm not really sure. It seemed to me something that one would hear or think about while meditating with a leader who believes in profound theory. Other than that, I just have no idea the purpose.",2,2017-07-02-06-08,2017-07-02-06-23,124
154,1,"Since I have difficulty with my hands due to arthritis, the little gel packs are the best for me. I dont have to be in pain trying to lift a larger box or container. I just pluck one from the bucket or bag and plunk it in the cup and close the dispenser. Thats all there is to it! Just dont use more than one pack per load, youll wreak havoc on your dishes and glassware and have a sudsy problem.~~~~Gel packs are the best because theyre not heavy and do not cause me pain. Sometimes I struggle with big bottles of liquid and wind up dropping the damn container with pain from grasping. ~~~~ Having arthritis was a big reason I switched. Another reason, is that the packs are so neat and tidy looking. There isnt the chance of a mess from spilling liquid or powder all over. The soft and hard gel packs are just the right size and light. I used to think the size would be too small at first, so I would use two. What a big mistake that was.~~",2,1,3,5,5,1,2,5,5,1,3,2,2,5,5,1,1,2,1,1,1,1,1,4,3,2,5,1,5,5,1,5,1,54,2,1,7,1,1,1,roman catholic,"Nothing, only that I would spend five minutes wriitng an essay.",Philosophy and relgious beliefs and self value beliefs.,3,2017-07-01-22-13,2017-07-01-22-25,84
155,2,"I had prayed to my goddess that my sister would get her new job in MA. I took a good 5 minutes praying and hoping she would get this job. The next day, she was hired, got a moving truck and had moved out of the house I was living in. I felt a bit of peace afterwards, for we were not getting along great. I knew right there that the Goddess was real, and that I was a true Wiccan. I had had a few times where I had renounced my faith, but I kept coming back, even if I had trusted in a new Goddess.",1,0,3,3,4,3,5,4,4,4,5,3,5,5,5,3,5,5,4,3,4,5,5,5,5,5,4,5,3,5,5,5,0,43,2,1,7,4,4,1,Wiccan,Writing would be involved.,Faith and philosophy intertwined in consciousness. If we use religion for the reason of being and existence.,3,2017-07-01-16-26,2017-07-01-16-42,129
156,1,"We would like you to consider and write about an everyday experience that you have had, specifically an experience that helps describe an average day in your life.~~We would like you to consider and write about an everyday experience that you have had, specifically an experience that helps describe an average day in your life.~~We would like you to consider and write about an everyday experience that you have had, specifically an experience that helps describe an average day in your life.~~~~~~We would like you to consider and write about an everyday experience that you have had, specifically an experience that helps describe an average day in your life.~~",1,0,1,2,2,2,1,4,4,4,2,4,2,4,4,2,2,2,4,2,2,4,3,2,2,4,4,3,2,2,2,2,0,32,1,1,6,1,1,1,agnostic,"We would like you to consider and write about an everyday experience that you have had, specifically an experience that helps describe an average day in","We would like you to consider and write about an everyday experience that you have had, specifically an experience that helps describe an average day in your life.",2,2017-07-02-02-58,2017-07-02-03-07,80
157,1,"My everyday is pretty  much a repeat. Every morning I wake up and take a shower. After shower I sit down for a cup of coffee and a toast. While eating a toast and coffee, I listen to the news and check my emails and my to do list for the day/week. Once I have finished I get ready and head out to work by train. During work, I go through meetings, client interactions, emails and many other things. After work, I spend some time either going food shopping or household shopping before I head home. At home I spend some time with my loved one and my dog. My dog and I go out for a dog walk and the day get wrapped up with either a movie and some email work.",1,1,5,5,2,4,5,2,4,4,5,4,5,5,5,3,3,5,3,4,2,5,5,3,4,3,4,5,3,3,4,4,0,34,1,2,7,4,8,5,jewish,no,good,5,2017-07-02-16-30,2017-07-02-16-43,118
158,2,"The moment where I was sure there was someone watching over me was a few summers ago, I was on a trip abroad in Europe with some friends. We were at Amsterdam and we went out on friday night. Everything was going perfect, we were having lots of fun and we meet some guys who invited us to a local party. It was a very stupid decision but we were a little bit drunk so we agreed to go with them. We arrived at this abandoned factory, at first it didn't seemed strange because it was supposed to be this sort of rave. We arrived and we meet lots of people and I was pretty sure it was gonna be a good night. I was wrong. The police came and raided the party, it was complete chaos. Everyone was running away trying to hide from the cops and me and my friends didn't knew what to do because the cops were shouting in dutch. We hide for a while and I was praying extra hard not to get caught. I prayed so hard that I started crying and I promised that If we made it out of there alive and free I would go to church and pra",1,1,3,4,3,4,3,3,3,2,4,3,4,3,3,3,4,4,4,2,3,2,2,3,4,4,3,4,4,2,4,4,0,25,2,2,5,3,11,3,christian,I had no idea what is it about.,To know our perceptions regarding religion and our stand,3,2017-07-03-05-12,2017-07-03-05-21,98
159,1,"Since I work from home my daily life consists of making coffee to wake up, checking my email, etc on my iphone, and after that I usually make some breakfast, then settle into my bedroom where my desk and computer are to start working on my computer while I eat. I usually get my work done in a couple of hours then I set about doing hits on mturk to make extra money to help pay my bills.~~I usually work on hits from around 10 AM to about 3 or 4 PM.  I take a break in between around lunch time then I may do a bit of housework, or run errands.  I usually do hits for at least another 3 hours if there are any to do.~~After I feel exhausted and need to rest my brain, I watch some tv, check my phone for emails again, and then make dinner.  After dinner, I watch the news and then watch programs until I get sleepy and then go to bed at around 11 PM.",1,0,1,1,1,2,1,1,1,1,1,1,1,3,1,1,2,1,1,1,1,1,1,1,2,1,1,2,1,2,3,2,0,56,2,1,7,1,1,1,atheist,It was a study on storywriting and personality,Do you believe in god? is the question that I think this survey is about.,4,2017-07-01-18-11,2017-07-01-18-24,40
160,2,"If there was anything spiritually related that I'd have to think of, it'd have to be when I was a young child around the age of 10, where my parents would take me and my brother to this Buddhist temple, where everyone would gather round and decide to do things that would require our presence. I actually saw at one point where this woman in a silver fox fur coat, give one of the Buddhist monks a red envelope. So, I went up to the woman in the silver fox fur coat, approached her, touched her fur coat, and asked about what this is meant for. (Honestly, she actually responded quite well, and actually hugged me in her fur, simply because I praised her for wearing such a luxurious garment of clothing) She told me that this was how the Buddhist monks grant the spiritual protection of the people, in response of how the people give them the envelopes. The woman in the silver fox fur coat, however had changed not just my spiritual & religious beliefs, but other things, as well (this might get a little graphic). So, the thing is, we decided to have sex in the rooms that usually no one goes into, because it is sacred to the temple, but this woman in the silver fox fur",2,1,3,2,2,3,3,3,3,2,4,2,2,3,3,2,3,3,3,2,2,2,2,2,3,3,2,2,3,2,5,3,0,20,1,2,5,2,4,3,Buddhist,It was about religion,It may have been for research purposes.,2,2017-07-02-04-19,2017-07-02-04-29,79
161,1,"An everyday experience I have is preparing meals for 4 children. They all have their own preferences and it is very difficult to find one thing that they all like and will eat without complaint. Just when I think I've found something, a child who previously liked the meal has now decided not to like it anymore. This can be immensely frustrating. Even with something as simple as peanut butter and jelly sandwiches there are all of these individual preferences that, if I don't get just right, I am sure to hear whining and fussing about. One wants a whole sandwich, the others want halves. Easy enough, right? Wrong. Some of them want their sandwiches cut, some want them uncut. Some want grape jelly, some strawberry. One prefers his with sliced up bananas and raisins, but heaven forbid I give the other children that, there will be an uproar. Who ever thought that feeding children could be so exhausting. And just when you get the job done and cleaned up, it's time for the next meal!",2,1,1,1,1,3,3,1,1,4,2,1,1,1,1,1,1,2,1,1,1,1,3,1,2,2,2,1,3,2,4,2,0,37,2,2,7,6,3,6,protestant,"I knew that there was going to be a 5 minute writing component, followed by some questions and that it would take about 30 minutes in total to complete.","I think the study was investigating whether one's religious beliefs, or faith in God would affect their answers to the questions.",2,2017-07-02-21-03,2017-07-02-21-25,51
162,1,"One of my everyday experiences include the act of going to work. I wake up at 5 a.m., and then I make my bed. After that, I get my clothes out of the closet, and then head to the bathroom. It takes me about 30 minutes to get ready. I then make my lunch, brew some tea, and head out the door. I wait about 10 mins for the bus. It takes about 30 minutes to get work. When I arrive, I clock in, and begin the day. ~~~~At the end of my workday, I clock out and head to the bus stop. I wait about 10 mins for the bus. It takes about 30 mins to get home. Once I arrive home, I cook dinner. Once dinner is ready, I make my plate, and sit down and watch my favorite tv program. After eating, I get ready for bed. I take off my work clothes, and head upstairs. I put on my pajamas, and go to dreamland. LOL.",1,0,4,4,4,4,4,3,4,4,4,3,5,3,3,4,3,4,4,4,3,4,3,5,4,4,4,3,4,3,5,4,0,33,2,2,7,3,4,4,Christainity,That it was going to assess our story writing and personality?,"Are we religious? Do we believe in higher self, or supreme?",3,2017-07-02-20-18,2017-07-02-20-30,114
