id,iv1_write,iv1_text,iv2_threat,threatened,bullshit_receptivity_scale_1,bullshit_receptivity_scale_2,bullshit_receptivity_scale_3,bullshit_receptivity_scale_4,bullshit_receptivity_scale_5,bullshit_receptivity_scale_6,bullshit_receptivity_scale_7,bullshit_receptivity_scale_8,bullshit_receptivity_scale_9,bullshit_receptivity_scale_10,bullshit_receptivity_scale_11,bullshit_receptivity_scale_12,bullshit_receptivity_scale_13,bullshit_receptivity_scale_14,bullshit_receptivity_scale_15,bullshit_receptivity_scale_16,bullshit_receptivity_scale_17,bullshit_receptivity_scale_18,bullshit_receptivity_scale_19,bullshit_receptivity_scale_20,bullshit_receptivity_scale_21,bullshit_receptivity_scale_22,bullshit_receptivity_scale_23,bullshit_receptivity_scale_24,bullshit_receptivity_scale_25,bullshit_receptivity_scale_26,bullshit_receptivity_scale_27,bullshit_receptivity_scale_28,bullshit_receptivity_scale_29,bullshit_receptivity_scale_30,brs_not_naive,age,gender,god_belief,certain_of_god_belief,prayer_frequency,prayer_duration,religious_attendance,religious_affiliation,previous_knowledge,purpose_guess,purpose_guess_certainty,start_time,end_time,brs_total
1,2,i am believe my god. i am very like. most important in my life.,1,1,1,3,2,1,2,1,2,1,2,1,1,2,1,1,2,1,1,2,1,1,2,2,1,1,2,2,1,2,1,1,1,35,1,2,6,5,7,6,Hindu,No,i like,4,2017-07-01-05-39,2017-07-01-05-54,44
2,2,"There have been many experiences that I would consider religious. One of these exact moments was whenever my oldest daughter wanted to be baptized. She made this decision on her own, and wanted to be closer to God.",2,1,3,3,2,2,2,2,2,3,3,3,4,2,4,1,2,2,2,3,3,2,3,2,2,4,1,2,3,2,3,2,0,39,1,2,7,6,6,5,Christian,I knew nothing,I have no idea.,3,2017-06-30-16-43,2017-06-30-16-52,74
3,2,"I was at a baseball game at the age of 10.  I was playing.  I had to go to the bathroom to take a huge dump.  I was prairie-dogging it.  I was pleading to God the whole way to the bathroom, to help me not to shit my pants.  Before this point, I didn't really believe much in God.  Seemed like something all the other kids did, but my parents weren't religious.  I wanted to believe, so I asked God to help me not to shit my pants.  I realized that it wouldn't have been a big deal, because playing a baseball game, our uniforms would get brown from time to time.  Unfortunately, I never slid on my ass, so everybody would know it was a poo stain.  After I made it to the toilet and released my load, I exhaled and said aloud, ""Thank the Lord!.""  Then I heard him say, ""You're welcome, my child.""  God had spoken to me and from that point on, I knew there was a God!  Whenever I hear someone say, ""Holy Shit!,"" it makes me think of this incident.",2,0,2,2,1,1,2,1,2,1,2,2,1,1,1,1,2,4,3,2,2,1,1,2,2,1,1,2,1,2,2,1,0,40,1,2,2,1,1,1,Christian,Doing some writing,writing about a spiritual experience will make us think ridiculous statements are more profound.,3,2017-06-30-17-14,2017-06-30-17-26,49
4,1,"Work is the part of my life that is a daily thing that I tend to hate and wish I could avoid.  I work in adult mental health in a program where training and skill development is the focus.   I conduct groups and I am increasingly not patient and very dissatisfied.   Because of this, I tend to spend most of the time I have dreading work, hating work, wishing that I could call off or quit or find a way, any way, to avoid the daily hassle and sense of helplessness.   Work tends to be the daily task that represents who we are.",2,1,4,5,1,5,3,4,3,2,2,3,3,2,1,2,5,2,3,2,5,1,1,4,4,3,2,3,5,1,2,4,0,36,2,2,5,5,4,6,luthern,none,I feel that the use of thinking and cognitions and how to improve upon ones thought process,4,2017-07-01-01-11,2017-07-01-01-29,87
5,2,"My father passed away five years ago resulting in my loss of faith. I thought to myself, if there is a real god, why did my father have to die so unexpectedly? He was young, healthy, happy and had so many reasons to live. However, after a few months of feeling this way, I had a dream one night that made me question my faith yet again. I had a dream in which god visited me and explained to me why exactly it was that he decided to bring my father home. I know it may sound dumb, but the dream itself felt so real that I from that moment on never questioned my faith again.",2,1,2,2,3,2,3,2,3,3,3,3,4,2,3,2,2,3,2,3,3,3,3,3,3,2,2,2,3,3,2,2,0,30,2,2,5,5,3,3,byzantine catholic,That it was on a religious topic,If someone can lose and then regain their faith in god,3,2017-07-01-14-13,2017-07-01-14-23,78
6,1,"Every morning I wake up to my daughter jumping on my bed asking for breakfast, after trying to sleep for 5 more minutes, I finally get up, I make breakfast, put on the TV and get our drinks. After breakfast I clean up, then sit down and begin working on mturk. I work on this for a few hours until it is lunch time. Then I make lunch, feed my daughter. Then spend some time cleaning. I work for another hour, until I need to get dinner started. I start dinner,it is normally in the crock pot. So while it cooks I can get some more work in before my husband gets home. Once he gets home we eat dinner, watch a movie together. Then I clean up from dinner, he relaxes. My daughter is then laying in her room, and he goes to lay down. I spend another two hours working. Then I go to bed.",2,0,2,4,4,3,4,5,5,5,4,1,5,3,5,1,4,3,3,2,1,4,3,5,5,4,1,1,3,4,5,3,0,25,2,1,5,1,1,1,agnostic,nothing,To see how peoples religious views effect their daily opinions and views.,4,2017-06-30-20-51,2017-06-30-21-02,102
7,2,I have had a spiritual experience once or twice in my life. I sometimes get some strong feelings that something is going on out of my control. I feel like it is very powerful. I have taken the time to focus on this feeling. It changes the way I think and feel about the world. I really have no way to put it into words because it is just the way I feel. I can focus on this feeling sometimes for what seems like a little bit of time and other times it just seems to go away. I think some people might think it is like when someone might pray but to me it is different. It is about focusing on the bigger picture and what might be out there. I try my best to figure things out but sometimes I am left with more questions then answers. Other times I feel like I have some sort of break through and was on to something. If I knew more maybe it would help in trying to put it into words. This is why I say it is a spiritual experience because words do not work. It is only feelin,1,0,3,3,3,2,3,3,3,3,3,3,3,4,3,4,2,3,3,4,3,3,3,4,3,3,4,3,4,4,4,4,0,34,1,1,4,2,11,2,none,nothing,How religion has lost but the spirit is on the rise.,2,2017-06-30-21-44,2017-06-30-21-57,97
8,2,"I had no hope when my mother was in a hospital for a disease. My grades were dropping in high school and I was in a bit of a depression. When I started to see her slowly recover my faith and spiritual belief was heigthened. My mother, the closest person to me, recovered from kidney disease, a miscarriage, and a stroke and is still here in my life. This was the moment I realized my beliefs came into fruition. I has serious doubts on the existence of God, but situations such as this changed my perspective on that. Although I am not the most religious person, I do belief God does exist in my realm and I will continue to be optimistic on this aspect of my spirituality.",2,0,3,2,4,5,5,2,2,4,3,2,3,1,4,1,2,4,3,2,3,4,2,2,4,2,2,3,2,3,2,3,0,20,2,2,6,3,4,3,Methodist,I knew I had to write and complete a questionnaire,To understand religion perception and profound ideas,3,2017-07-01-05-27,2017-07-01-05-39,84
9,1,"My dog Bailey schedules my day.  She waits patiently for me to wake up, but once I stir in bed, there is her wet nose in my face.  Bailey's main objective each morning is to get me dressed and out the door for a walk.  I make her wait, laying by my side as I drink a cup of coffee.  Her ears droop if I decide to enjoy a second cup.  Labradors have little patience.  ~~~~After perusing the news ad finishing coffee, we finally get the red leash out and head to Mavrakis pond.  It is a place of wonderment for both of us.  There are ducks, turtles, fish and even deer.  Today she sniffed into some brush and jumped straight up and back!  She found a snake!",1,0,1,3,3,2,1,1,2,2,1,1,1,1,3,1,5,1,1,1,1,2,1,3,5,1,1,1,4,4,2,1,0,59,2,1,7,1,1,1,agnostic,nothing,To better understand people's spiritual views,5,2017-07-01-05-53,2017-07-01-06-06,57
10,2,"I do not have religion believes or get fixated on such things, I do have spiritual practice which include understanding of things, connected to the inner self and find our my thoughts better.  I have at time feel like being one with nature in natural setting where sense of time slow down and I can feel life energy in nature, from the trees to the animals enhance my sense and have a direct effect on my well being and thoughts",2,0,1,3,1,1,2,2,2,1,1,1,1,2,1,1,2,2,2,2,2,1,1,1,2,1,1,2,1,1,1,2,0,31,1,2,4,1,1,1,spiritual but not religious,personality preference,self actualization ~~view on religion and growth~~,2,2017-06-30-17-49,2017-06-30-18-00,44
11,2,"I cannot say I have had a religious experience.  I grew up in a Catholic home, but have always had my doubts about God.  I believe that those who have had religious experiences had them as a result of some kind of chemical reaction within their own brains.",2,0,1,1,1,1,1,1,1,1,1,1,1,1,1,1,1,1,1,1,1,1,1,1,1,1,1,1,1,1,1,1,0,38,1,1,3,2,4,3,Catholic,nothing,?,1,2017-06-30-16-50,2017-06-30-16-59,30
12,1,"When I wake up in the mornings I like to go into my Ladies Den and do some acrylic painting. it helps me start the day in a relaxing mode. Then my husband wakes up about a half hour later farting his way down the hallway and turns on Fox News in the livingroom. When that happens I turn up the volumn on my laptop since I'm watching Netflix. Typically a show like ""Women Behind Bars."" My husband proceeds to get himself some breakfast and if it's cereal he spends about 10 minutes clanking the spoon against the ceramic bowl in a manner that makes me sympathize with the women on the show I'm watching. About 30 minutes later I shut down everything in my Ladies Den and go into our bedroom to get dressed and ready for work. My husband comes in and gives me a kiss and we hug, the normal morning goodbyes. He grabs his survivalist backpack and his gun on his way out the door as I make ""pew pew pew"" noises down the hallway to myself. This happens basically 5 days a week. He's a republican and I'm a democrat.",1,0,4,1,1,1,4,1,3,3,1,3,1,3,4,1,3,3,1,3,1,1,2,3,4,1,2,2,3,3,2,1,0,46,2,1,7,1,1,1,None,Nothing,Do you believe in God? I believe that is the purpose of this study. To see if a day in my life had anything to do with a religious ritual. That would be difficult when you hear your husband farting all morning.,6,2017-06-30-23-34,2017-06-30-23-49,66
13,2,"When my daughter was admitted to the hospital for self harm, any religious beliefs I had left me.  God did not answer my prayers for her, and in the ensuing struggle over the past four years, he has not been there for me.  There was no solace for me, no help, no guidance, no action.  So I have no use for a god that doesn't help me, and I am pretty much a firm non believer at this point/stage of my life.  I prayed and prayed then and after, and nothing.  I don't understand why in this country everyone feels like there is something wrong with you if you don't believe in god.  It's ridiculous.  He hasn't done anything for anybody that I can see.",2,0,3,1,4,3,1,1,2,2,3,1,3,1,4,1,5,1,4,2,1,1,2,2,1,1,2,2,2,2,2,2,0,52,2,1,6,1,1,1,none,nothing,beliefs in god compared to thoughts on profoundness,2,2017-06-30-23-28,2017-06-30-23-37,62
14,1,"Yesterday, I woke up at 6:00 a.m. and drank two cups of coffee. I always drink two cups of coffee when I awake, because the caffeine gives me that early morning rush I need to move quickly. Once my caffeine sets in, I do some housework. I normally feed the rabbits first, and then I refill their water bottles. If any of the rabbits have a dirty cage, I clean their bedding or litter, depending on what the rabbits are trained to use. After the rabbits are taken care of, I do the dishes from the previous night's dinner. Then I vacuum the living room and front room and spray the house with Febreze before I leave for work. I leave for work at 7:25 a.m., so it essential that I get everything done before I leave for work. I absolutely hate coming home from work and having to do more work (i.e. housework). After work, I usually come home and water my plants. I have a garden in which I grow ornamental corn, pumpkins, gourds, tomatoes, and peppers, and if you know anything about gardens, any kind of squash is a very heavy drinker. They need a good deep watering at least every other day. I also have a sunflower patch that I water, which is located adjacent to the garden. They are heavy drinkers also. Lastly,  water my ninebark bush in the front yard, because it starts wilting as soon as it gets dehydrated.",2,0,5,1,4,3,1,1,5,4,2,1,1,1,5,2,4,2,2,4,1,5,4,1,5,1,3,4,5,3,4,3,0,28,2,1,7,1,1,1,Atheist,"I knew nothing about this experiment. It sounded fun on mTurk, so I participated... that is all.",Does a person's level of religiosity correlate with their interpretation of profundity?,3,2017-07-01-14-27,2017-07-01-14-45,87
15,2,When I was young I remember needing a surgery that was very serious and that is when I said that If I survived I would dedicate myself to Christianity. ~~I gained great faith and I became grateful to live. I think that I received an opportunity to stay during these hard times because god has a very special and exciting plan for me and my family. I grew in spirit by reading the bible and reading about all of the hard times that others went through. In this book I read wisdom.,2,0,4,2,1,5,2,3,5,2,4,4,5,3,1,2,4,2,4,5,2,1,3,5,4,4,2,5,1,1,3,1,0,35,1,2,3,5,11,3,Catholic,none,not sure,2,2017-06-30-21-16,2017-06-30-21-23,90
16,2,"I've watched my parents all my life be wonderful Christians - their strong beliefs have been a light to me from a young age. When I was still in elementary school I came down with pneumonia and was very sick for a while. One night I was suffering and asked my parents to pray for me - God healed me that night. The pneumonia was gone. I've never forgotten that experience, and it was the ultimate proof to me that God is real and He loves me.",1,1,3,3,1,1,1,1,1,2,3,1,1,1,2,1,2,2,2,1,1,1,1,3,1,1,1,2,2,1,2,2,0,30,2,2,7,5,8,4,Non-denominational,Nothing.,What is the connection between religious beliefs and open-mindedness? Are the studies true about Christianity declining?,2,2017-07-01-03-48,2017-07-01-04-05,47
17,2,"hello darkness my old friends, I come to talk to you again. The visions that were planted in my brain, still remains, in restless dreams I walk alone, in the halo of street lamps. In the naked light I saw, ten thousands people or even more, people talking without speaking, people writing songs that voices never shed. And the signs of the words of the promise whisper.",1,0,3,3,5,5,5,3,3,5,5,5,3,3,5,3,5,4,4,5,3,5,3,5,5,3,3,5,5,5,5,3,0,23,1,2,6,3,2,4,Catholic,a series of surveys. But the questions are good,the scientific mind of religion,4,2017-06-30-23-30,2017-06-30-23-38,124
18,2,When I was in Iraq there was a point I was convinced we were dead.  There was no way we were ever going to get through the day. However we had air cover come in and save all our lives.  I knew there had to be someone helping me.  If they had gone any longer we would have been wiped out by the number of enemy we were facing.  Throughout all of the invasion I continued to read the bible to get me through the hardest days.  My whole squad returned from that first deployment together an unharmed.  While not all my friends made it those that I slept next to on a daily basis all did.  Something had to be going right for that to happen.  It reminded me of the footprints poem about that was when God carried me.,1,1,5,2,1,4,5,5,3,2,4,1,2,1,4,3,5,3,4,4,2,5,3,3,5,2,1,1,4,3,1,1,0,35,1,2,6,4,5,4,Catholic,Nothing,It was about Christianity in America.,3,2017-07-01-14-20,2017-07-01-14-32,89
19,2,"There was a time when I was struggling with my Christian identity and I wanted to know how God saw me. I had my eyes closed and I was praying and asking how I saw myself and I was immediately brought an image of a scene from Saving Private Ryan where a guy on the beaches of Normandy was hidden behind a barricade and had dropped his rifle and was crying.~~Then I asked God how HE saw me and he brought me an image of Aragorn from Fellowship of the Ring where he was humble enough to tell Frodo that he did not desire the ring and then stood to face wave after wave of enemy orcs to protect the ""innocent"" and ""defenseless"" hobbits. ~~That was when I began to understand what God had called me to do and be and he gave me the verse: Isaiah 61:1-3, basically proclaiming freedom of the captive and release of the prisoners; essentially: fight for those who cannot fight for themselves.",1,1,2,1,1,1,1,3,1,1,2,1,1,2,2,1,3,1,1,1,1,1,1,2,1,1,1,2,1,1,1,1,0,42,1,2,7,5,7,6,Assembly of God,"Didn't know anything about it, but it seemed like statements from a bunch of scientists who would like to be in the next Christopher Nolan space movie.",The origin of the mind and consciousness.,4,2017-06-30-20-36,2017-06-30-20-51,40
20,2,"We were stranded in an airport.  That wasn't uncommon, we often traveled with my Dad so that he could work for several weeks in one place without having to fly home on weekends.  What was unusual was the snow storm and the power outage in the terminal we were in.~~~~I'd been a Wiccan for several years at that point, it had fallen into the patterns of daily life and faded from the bright new thing it had been when I first started.  It was almost a non-question, actually, and most of what stuck with me was the aesthetics, the songs and chants, the colors and art.~~~~So there we are, my mom, my dad, and myself, a 14 year old wiccan girl with absolutely nothing to do, in a freezing airport terminal with dozens of other families stuck in a freezing airport terminal, and I begin singing ""Unity of the Elements"" to entertain myself.  Everyone sings along,",2,0,4,4,4,1,5,1,2,3,1,2,5,3,3,5,5,2,3,4,1,3,3,4,2,4,2,4,3,4,4,4,0,28,2,2,5,5,2,1,Wiccan,Only what the survey description said.,"I think the study may have been about how people react to religious, spiritual, or metaphysical ideals.",5,2017-06-30-21-25,2017-06-30-21-37,95
21,1,I get up in the morning and take my medicine.  Then I get online and work until about 1:00 PM.  I get something for lunch.  Then I wash dishes and clothes.  I do other housework such as cleaning my bedroom or one of the other rooms in the house.  Later on I get back online and work online on my other things plus look at my email and get on Facebook for a while.  I sometimes play some of my other games on the computer.,2,1,4,5,3,2,2,4,4,2,4,5,5,5,3,3,4,3,3,4,4,4,5,2,3,3,3,3,4,3,2,1,0,65,2,2,6,5,5,1,Pentacostal,nothing,to see how many people believe in consciousness.,3,2017-07-01-04-16,2017-07-01-04-32,102
22,1,"I got up at 7:00 am. I took a shower, brushed my teeth, and put on my work clothes. I grabbed a breakfast sandwich from the local Dunkin' Donuts near my apartment building as I hurried to the train station to take the red line to downtown Chicago. I arrived at work by 9:00 am. I got to my workstation and read e-mails and progress reports on the various projects I am on. By 11:00 am, I was in the first of two meetings. I presented some material to my work group and others do the same. By 1:00 pm, I headed out to lunch. I picked up a lunch meal at the Subway near my work building. I arrived back to my workstation by 2:00 pm. From 2:00 pm to 5:00 pm, I was working on various aspects of my job.I ask my team mates about the state of their work and what should and should not be covered in the second meeting later today. By 5:30 pm, I entered my second meeting to debrief my co-workers on the progress I have made today. By 6:00 pm, I started to head home. I arrived home via train by 7:00 pm. I cook dinner with my fiance. After dinner when snuggled together on the couch at watch our favorite TV shows, or they are on a re-run, pop in a movie from my Blu-Ray collection to watch. At this point, it is 11:00 pm, so my fiance and I are getting a bit tired. We finish the movie and start preparing for bed. She and I take showers and talk about the day and what to expect tomorrow. By 12:00 am, we bout are in bed, really to get some good night sleep after a long day.",2,0,3,3,3,3,3,4,2,4,4,3,3,4,4,4,2,2,5,4,1,2,1,4,1,2,2,4,5,2,2,3,0,33,1,1,6,1,1,1,none,nothing,I do not know.,1,2017-06-30-20-20,2017-06-30-20-29,89
23,2,Listening to some music and just taking it all in. The words spoke to me and I really felt it. Started to sway back and forth and became happy. I got so into and started singing along. Then I just felt the energy and started happily crying with tears. It lasted for a few minutes. Then I was filled with happiness and felt I could take on the world.,1,0,1,5,1,1,1,1,1,1,3,1,5,1,2,1,5,1,1,1,1,1,1,1,5,1,1,1,1,1,1,1,0,35,1,2,4,2,2,1,none,nothing,spirituality test,3,2017-07-01-00-34,2017-07-01-00-44,49
24,1,"I arrive at work. I briefly check to ensure that everything is where it should be. I will think about the academia I need to remember in order to increase the probability that I will do well on my next test. I will begin to make customers their food and to clean when time permits this. I will work for about two hours and then I will take a thirty minute break. I will eat something simple that I brought from home. This something will very likely be something that can be quickly cooked in the microwave. I will proceed to eat and, perform more thorough studying. I will finish my break and go and get some more cleaning and organizing done. During this time I will be a little social if there is enough time and pace to do so. If we are busy, I will focus primarily o the tasks at hand. I will wave to one familiar face during the latter hours of the day. The world is a very small place.",1,1,4,4,2,2,3,3,3,3,2,2,3,2,4,2,5,3,2,2,2,2,2,3,3,2,2,3,4,2,2,3,0,27,1,2,7,6,4,6,"Latter-Day Saint (""Mormon"")",All I knew was that this had something to do with writing and personality.,To discover what religious and non-religious people find profound.,4,2017-07-01-04-45,2017-07-01-04-59,81
25,2,"Raising my kiddo alone and being a Mother who had made mistakes in my life, there came a time when I was so discouraged that I didn't want to go on.  One evening when my kiddo was asleep my prayers were to just please make this awful life stop and if this took a car accident or something for me to disappear and give my child a better life than I could provide then so be it.  Tears were flowing and I couldn't get my thoughts off of my mistakes and onto the fact t hat I was loved unconditionally and forgiven.  The next day was a wake up call that made my life",2,1,2,2,2,2,3,1,3,3,2,2,3,3,4,1,4,2,1,3,3,3,2,3,4,1,4,4,2,3,3,2,0,57,2,2,5,5,2,5,Christian,Nothing,Curiosity about the depth folks believe and how they retained a belief.  If the focus is on the universe and nature vs. physics,2,2017-06-30-22-11,2017-06-30-22-25,77
26,1,An average experience for me is getting on Mturk. I spend a good portion of the early side of the day doing surveys or batch HITs on Mturk to make extra money. Generally I am doing it from 8am till about 2-3pm.,2,0,5,4,4,1,2,5,2,5,3,4,4,3,3,5,3,5,4,4,3,5,5,5,5,4,5,5,4,5,4,3,0,25,1,2,7,6,2,1,nothing in particular,I didn't know anything,I can't figure out what it's trying to test,1,2017-06-30-21-29,2017-06-30-21-38,119
27,1,"I woke up and went for my daily morning run around the neighborhood. It's 6:30am but there are quite a few people around already, some are walking their dogs, going to work or running just like me. I say hello to people I know as I run. I stop off at the local convenience store to pick up a paper I can read while eating breakfast. On the last leg on my run I stop in at the local bakery to get fresh bread so I can make sandwiches for my lunch. After I run the final 5 minutes to my apartment building.",2,0,2,1,1,1,3,1,2,3,3,1,4,2,3,4,1,3,2,2,2,2,2,4,2,4,5,4,4,3,5,3,0,47,1,1,7,1,1,1,Atheist,That it was about story writing and personality.,To define our English proficiency and views on God/religion.,2,2017-06-30-21-46,2017-06-30-22-00,79
28,2,"My husband and I were attending a small church close to our house.  We had become members, volunteered our talents to the church, and gave tithes.  After four years, we started to notice divisions in the church.  The head pastor took full control and fired the assistant pastor.  The head pastor began to use his pulpit as a way to banish anyone who did not homeschool their children like his wife taught their own children. Next, he hired another assistant pastor who never questioned the head pastor and gave sermons that were an hour and a half long.  ~~~~One afternoon, I was cleaning my home and listening to Christian music.  I was praying about what to do next.  I suddenly felt the presence of God.  Hairs raised on the back of my neck.  I hear a voice say, ""It's going to be okay.  Leave that church.  It's okay.""  We left that church and found a more loving and less bullying",2,0,2,1,1,2,1,3,1,1,1,1,1,1,2,1,1,1,1,1,1,1,1,1,1,1,1,1,2,1,1,1,0,31,2,2,7,5,4,6,Nondenominational Protestant,"I would write a story, read an article, and answering questions",How a person's religion affects their view on life,3,2017-07-01-03-45,2017-07-01-03-58,36
